Indeks,Komentar,Komentar_bersih,normal_teks,Label,Label_Validator
H-1056,Video Pesawat Menyemprotkan Zat Yang Dapat Membuat Orang Sakit Tenggorokan dan Demam,video pesawat menyemprotkan zat yang dapat membuat orang sakit tenggorokan dan demam,video pesawat menyemprotkan zat yang dapat membuat orang sakit tenggorokan dan demam,2,2
H-1057,Link untuk Mendaftar PKH,link untuk mendaftar pkh,tautan untuk mendaftar pkh,2,2
H-1058,Bocah Perempuan 5Tahun Di Cabuli 7 Orang Yg Mengaku Dirinya CEBONG Di Grup Pendukung Anies Baswedan,bocah perempuan 5tahun di cabuli 7 orang yg mengaku dirinya cebong di grup pendukung anies baswedan,bocah perempuan 5tahun di cabuli tujuh orang yang mengaku dirinya cebong di grup pendukung anies Baswedan,2,2
H-1059,Surat Edaran Pengangkatan Tenaga Honorer Menjadi CPNS Tanpa Tes Oleh Kementerian Pendidikan Kebudayaan Direktorat Jenderal Guru dan Tenaga Kependidikan,surat edaran pengangkatan tenaga honorer menjadi cpns tanpa tes oleh kementerian pendidikan kebudayaan direktorat jenderal guru dan tenaga kependidikan,surat edaran pengangkatan tenaga honorer menjadi cpns tanpa tes oleh kementerian pendidikan kebudayaan direktorat jenderal guru dan tenaga kependidikan,2,2
H-1060,"Menag Yaqut: Saya Pastikan Pembangunan KIBLAT Yang Baru Untuk Umat Islam Nusantara, Akan Segera Di Bangun Dan Kami Sudah Bekerjasama dgn pemerintahan China, Dan Lokasi Pembangunan nya Bertempat Di China",menag yaqut saya pastikan pembangunan kiblat yang baru untuk umat islam nusantara akan segera di bangun dan kami sudah bekerjasama dgn pemerintahan china dan lokasi pembangunan nya bertempat di china,menag yaqut saya pastikan pembangunan kiblat yang baru untuk umat islam nusantara akan segera di bangun dan kami sudah bekerjasama dengan pemerintahan china dan lokasi pembangunan nya bertempat di china,2,2
H-1061,Saking Bencinya Menag & Islam Nusantara Terhadapa Arab Sampai Logo Halal Yg tadinya Pakai Huruf Arab pun di ganti Dgn Gambar Wayang,saking bencinya menag islam nusantara terhadapa arab sampai logo halal yg tadinya pakai huruf arab pun di ganti dgn gambar wayang,saking bencinya menag islam nusantara terhadapa arab sampai logo halal yang tadinya pakai huruf arab pun di ganti dengan gambar wayang,2,2
H-1062,Artis Senior ‘NIA DANIATI’ Meninggal Dunia Akibat Kecelakaan Mobil,artis senior nia daniati meninggal dunia akibat kecelakaan mobil,artis senior nia daniati meninggal dunia akibat kecelakaan mobil,2,2
H-1063,Gambar ” Jokowi menghadang tank sendirian di kerusuhan ukraina”,gambar jokowi menghadang tank sendirian di kerusuhan ukraina,gambar Jokowi menghadang tank sendirian di kerusuhan ukraina,2,2
H-1064,Dokumen Pelunasan Hutang dan Dana Hibah dari Kesultanan Buton Kepada Perancis,dokumen pelunasan hutang dan dana hibah dari kesultanan buton kepada perancis,dokumen pelunasan hutang dan dana hibah dari kesultanan buton kepada perancis,2,2
H-1065,Pria Asal Solo Meninggal Dunia Akibat Memakan Kangkung Berisi Lintah,pria asal solo meninggal dunia akibat memakan kangkung berisi lintah,pria asal solo meninggal dunia akibat memakan kangkung berisi lintah,2,2
H-1066,St. Louis Arch Menyalakan Lampu Biru dan Kuning Sebagai Bentuk Dukungan kepada Ukraina,st louis arch menyalakan lampu biru dan kuning sebagai bentuk dukungan kepada ukraina,st louis arch menyalakan lampu biru dan kuning sebagai bentuk dukungan kepada ukraina,2,2
H-1067,"Anak-anak disuntik dgn zat bius dan akan diekspor ke Thailand, mereka akan dibunuh untuk diambil organnya",anakanak disuntik dgn zat bius dan akan diekspor ke thailand mereka akan dibunuh untuk diambil organnya,anakanak disuntik dengan zat bius dan akan dieksport ke thailand mereka akan dibunuh untuk diambil organ,2,2
H-1068,Kain Sarung Atlas Edisi Atlas Idaman Harmoni Bermotif Anjing,kain sarung atlas edisi atlas idaman harmoni bermotif anjing,kain sarung atlas edisi atlas idaman harmoni bermotif anjing,2,2
H-1069,Gamblang! Putin Jelaskan secara Logis Nubuat Nabi Muhammad,gamblang putin jelaskan secara logis nubuat nabi muhammad,gamblang putin jelaskan secara logis nubuat nabi muhammad,2,2
H-1070,pendamping untuk Sertifikasi Halal dalam suatu UMKM itu syaratnya harus GP ANSHOR,pendamping untuk sertifikasi halal dalam suatu umkm itu syaratnya harus gp anshor,pendamping untuk sertifikasi halal dalam suatu umkm itu syaratnya harus gp anshor,2,2
H-1071,Polisi Uganda Menyerang Reporter Karena Memberikan Pertanyaan yang Tidak Relevan,polisi uganda menyerang reporter karena memberikan pertanyaan yang tidak relevan,polisi uganda menyerang reporter karena memberikan pertanyaan yang tidak relevan,2,2
H-1072,Arab Saudi Tidak Mewajibkan Masker untuk Jamaah Masjidil Haram dan Masjid Nabawi serta Akan Menyediakan Asuransi Kesehatan,arab saudi tidak mewajibkan masker untuk jamaah masjidil haram dan masjid nabawi serta akan menyediakan asuransi kesehatan,arab saudi tidak mewajibkan masker untuk jamaah masjidil haram dan masjid nabawi serta akan menyediakan asuransi kesehatan,2,2
H-1073,Bentuk Logo Halal Buatan Kemenag Terinspirasi Dari Penutup Kepala Uskup,bentuk logo halal buatan kemenag terinspirasi dari penutup kepala uskup,bentuk logo halal buatan kemenag terinspirasi dari penutup kepala uskup,2,2
H-1074,Suara Auman Raksasa di Aceh Pukul 5 Pagi,suara auman raksasa di aceh pukul 5 pagi,suara auman raksasa di aceh pukul 5 pagi,2,2
H-1075,"TERANG BENDERANG…! Rusia Bongkar Eksperimen Covid Di Lab AS Ukraina, Siti Fadilah: Sudah Bukan Konspirasi! Kejahatan Pasti Terungkap!",terang benderang rusia bongkar eksperimen covid di lab as ukraina siti fadilah sudah bukan konspirasi kejahatan pasti terungkap,terang benderang rusia bongkar eksperimen covid di lab as ukraina siti fadilah sudah bukan konspirasi kejahatan pasti terungkap,2,2
H-1076,Pengobatan Tumor Ganas/ Kanker CELL CURE RS Gatot Subroto Jakarta,pengobatan tumor ganas kanker cell cure rs gatot subroto jakarta,pengobatan tumor ganas kanker sel cure rs gatot subroto jakarta,2,2
H-1077,Foto Anak Kecil Di Tengah Puing-Puing Bangunan Dalam Invasi Rusia ke Ukraina,foto anak kecil di tengah puingpuing bangunan dalam invasi rusia ke ukraina,foto anak kecil di tengah puingpuing bangunan dalam invasi rusia ke ukraina,2,2
H-1078,Email dari Amazon Berisi Pengumuman Pemberian Kartu Hadiah Senilai 500 Dolar,email dari amazon berisi pengumuman pemberian kartu hadiah senilai 500 dolar,email dari Amazon berisi pengumuman pemberian kartu hadiah senilai 500 dolar,2,2
H-1079,Jet tempur Siluman NATO versus Rudal Rusia,jet tempur siluman nato versus rudal rusia,jet tempur siluman nato versus rudal rusia,2,2
H-1080,Lagi macet Di Rampok pakai pistol/senjata api di pasar ikan Penjaringan Jakarta Utara,lagi macet di rampok pakai pistolsenjata api di pasar ikan penjaringan jakarta utara,lagi macet di rampok pakai pistolsenjata api di pasar ikan penjaringan jakarta utara,2,2
H-1081,Mulai Awal Maret Kominfo Akan Unregistrasi Kartu Paket Jika Tidak Ada Aktivitas Internet 1×24 Jam,mulai awal maret kominfo akan unregistrasi kartu paket jika tidak ada aktivitas internet 124 jam,mulai awal maret kominfo akan unregistrasi kartu paket jika tidak ada aktivitas internet 124 jam,2,2
H-1082,Presiden Putin Peringati Jokowi Agar Tidak Ikut Campur Masalah Rusia dengan Ukraina,presiden putin peringati jokowi agar tidak ikut campur masalah rusia dengan ukraina,presiden putin peringati Jokowi agar tidak ikut campur masalah rusia dengan ukraina,2,2
H-1083,detik detik babi ngepet berubah jadi manusia tertangkap warga,detik detik babi ngepet berubah jadi manusia tertangkap warga,detik detik babi ngepet berubah jadi manusia tertangkap warga,2,2
H-1084,Innalillahi Wainna Ilaihirojiun😭😭😭Tepat Hari Ini 7 Maret 2022 Ayu Ting Ting Meninggal Dunia Setelah Mengalami Kecelakaan Maut😭😭😭,innalillahi wainna ilaihirojiun emoji_loudly_crying_face emoji_loudly_crying_face emoji_loudly_crying_face tepat hari ini 7 maret 2022 ayu ting ting meninggal dunia setelah mengalami kecelakaan maut emoji_loudly_crying_face emoji_loudly_crying_face emoji_loudly_crying_face,innalillahi wainna ilaihirojiun emoji_loudly_crying_face emoji_loudly_crying_face emoji_loudly_crying_face tepat hari ini tujuh maret 2022 ayu ting ting meninggal dunia setelah mengalami kecelakaan maut emoji_loudly_crying_face emoji_loudly_crying_face emoji_loudly_crying_face,2,2
H-1085,Akun Lesti Kejora Bagi Bagi Giveaway,akun lesti kejora bagi bagi giveaway,akun lesti kejora bagi bagi giveaway,2,2
H-1086,Jokowi Melarang Umat Islam Berkerumun di Masjid Apalagi Saat Idul Fitri,jokowi melarang umat islam berkerumun di masjid apalagi saat idul fitri,Jokowi melarang umat islam berkerumun di masjid apalagi saat Idul fitri,2,2
H-1087,"Mohon Doa Nya Kawan'' Selasa Pagi ,Innalillahi Wainna Ilaihi Raji'un, Tri Suaka Dan Rekan Nya Meninggal Akibat Kecelakaan",mohon doa nya kawan selasa pagi innalillahi wainna ilaihi rajiun tri suaka dan rekan nya meninggal akibat kecelakaan,mohon doa nya kawan selasa pagi innalillahi wainna ilaihi rajin tri suaka dan rekan nya meninggal akibat kecelakaan,2,2
H-1088,"Minyak ASRI seakan akan Islami, padahal minyak goreng produk LEONG HUP ini terbuat dari minyak babi",minyak asri seakan akan islami padahal minyak goreng produk leong hup ini terbuat dari minyak babi,minyak asri seakan akan islami padahal minyak goreng produk leong hup ini terbuat dari minyak babi,2,2
H-1089,"Innalilahi Ya Allah...😭😭, Kabar Duka Dari Raffi Ahmad Mengalami Kecelakaan Usai Pulang syuting, Mohon Do'anya Semoga Beliau Diterima Disisih Allah,Amin",innalilahi ya allah emoji_loudly_crying_face emoji_loudly_crying_face kabar duka dari raffi ahmad mengalami kecelakaan usai pulang syuting mohon doanya semoga beliau diterima disisih allahamin,innalillahi ya allah emoji_loudly_crying_face emoji_loudly_crying_face kabar duka dari raffy ahmad mengalami kecelakaan usai pulang syuting mohon doanya semoga beliau diterima disisih allahamin,2,2
H-1090,"Video “Tolak Resolusi P.BB, Ukra1na Ancm Tarik Kemerdekaan Indonesia”",video tolak resolusi pbb ukra1na ancm tarik kemerdekaan indonesia,video tolak resolusi pbb ukra1na ancm tarik kemerdekaan indonesia,2,2
H-1091,"Video “Jangan membiasakan anak Anda bermain HP, sangat berbahaya bisa terinfeksi radiasi HP dan bisa membutakan",video jangan membiasakan anak anda bermain hp sangat berbahaya bisa terinfeksi radiasi hp dan bisa membutakan,video jangan membiasakan anak anda bermain handphone sangat berbahaya bisa terinfeksi radiasi handphone dan bisa membutakan,2,2
H-1092,"Masjid Meledak di kota Narayanganj, Bangladesh Memakan korban 50 Jamaah",masjid meledak di kota narayanganj bangladesh memakan korban 50 jamaah,masjid meledak di kota narayanganj bangladesh memakan korban 50 jamaah,2,2
H-1093,Seorang Nenek yang Memegang Kucing Mengacungkan Jari Tengah kepada Tentara Russia,seorang nenek yang memegang kucing mengacungkan jari tengah kepada tentara russia,seorang nenek yang memegang kucing mengacungkan jari tengah kepada tentara russia,2,2
H-1094,Akun Karir PT Jasa Raharja,akun karir pt jasa raharja,akun karir pt jasa raharja,2,2
H-1095,Menteri Pekerjaan Umum Mongolia Membakar Diri,menteri pekerjaan umum mongolia membakar diri,menteri pekerjaan umum mongolia membakar diri,2,2
H-1096,Banjir Air Mata Tentara Ukraina Peluk Pasangan Sebelum Berangkat Perang,banjir air mata tentara ukraina peluk pasangan sebelum berangkat perang,banjir air mata tentara ukraina peluk pasangan sebelum berangkat perang,2,2
H-1097,Membedong Bayi Dapat Membuat Tulang Belakang Bayi Semakin Kuat Dan Rangka Tubuh Sempurna,membedong bayi dapat membuat tulang belakang bayi semakin kuat dan rangka tubuh sempurna,membedong bayi dapat membuat tulang belakang bayi semakin kuat dan rangka tubuh sempurna,2,2
H-1098,"KEMENTERIAN KESEHATAN UKRAINA: 57 MATI, 169 TERLUKA DI SELURUH UKRAINA KARENA SERANGAN RUSIA",kementerian kesehatan ukraina 57 mati 169 terluka di seluruh ukraina karena serangan rusia,kementerian kesehatan ukraina 57 mati 169 terluka di seluruh ukraina karena serangan rusia,2,2
H-1099,Indro Warkop Meninggal Dunia,indro warkop meninggal dunia,indro warkop meninggal dunia,2,2
H-1100,Akun Telegram FBS Investasi Harian,akun telegram fbs investasi harian,akun telegram fbs investasi harian,2,2
H-1101,Video Menunjukkan ‘Wanita Plastik Pertama’ Dibuat Oleh Cina,video menunjukkan wanita plastik pertama dibuat oleh cina,video menunjukkan wanita plastik pertama dibuat oleh cina,2,2
H-1102,Informasi Pengangkatan PPPK Tanpa Tes,informasi pengangkatan pppk tanpa tes,informasi pengangkatan pppk tanpa tes,2,2
H-1103,Sule Meninggal Dunia,sule meninggal dunia,sule meninggal dunia,2,2
H-1104,Video Mayat Propaganda NATO di Ukraina yang Sedang Merokok,video mayat propaganda nato di ukraina yang sedang merokok,video mayat propaganda nato di ukraina yang sedang merokok,2,2
H-1105,Baim Wong Meninggal Dunia,baim wong meninggal dunia,baim wong meninggal dunia,2,2
H-1106,Pemeran Mr. Bean Masuk Islam,pemeran mr bean masuk islam,pemeran mr bean masuk islam,2,2
H-1107,Harimau Berkeliaran Di Perkebunan Sawit Di Riau,harimau berkeliaran di perkebunan sawit di riau,harimau berkeliaran di perkebunan sawit di riau,2,2
H-1108,Siti Nurhaliza Meninggal Dunia,siti nurhaliza meninggal dunia,siti nurhaliza meninggal dunia,2,2
H-1109,Cara Mengecek Minyak Goreng Limbah,cara mengecek minyak goreng limbah,cara mengecek minyak goreng limbah,2,2
H-1110,Jokowi: Terlalu banyak peraturan kita pusing sendiri jadi stres,jokowi terlalu banyak peraturan kita pusing sendiri jadi stres,Jokowi terlalu banyak peraturan kita pusing sendiri jadi stres,2,2
H-1111,Elon Musk Menghapus Akun Twitter Greta Thunberg pada 9 Maret 2023,elon musk menghapus akun twitter greta thunberg pada 9 maret 2023,elon mask menghapus akun Twitter greta thunberg pada sembilan maret 2023,2,2
H-1112,Jenazah Ferdy Sambo Dipulangkan ke Jakarta Usai Jalani Eksekusi Mati,jenazah ferdy sambo dipulangkan ke jakarta usai jalani eksekusi mati,jenazah ferdy sambo dipulangkan ke jakarta usai jalani eksekusi mati,2,2
H-1113,Ayah Brigadir J Ditahan Usai Hina Kapolri,ayah brigadir j ditahan usai hina kapolri,ayah brigadir j ditahan usai hina kapolri,2,2
H-1114,Gelombang Tinggi Lenyapkan Kota di Indonesia,gelombang tinggi lenyapkan kota di indonesia,gelombang tinggi lenyapkan kota di indonesia,2,2
H-1115,JADI BURONAN KPK !! SRI MULYANI KABUR KE LUAR NEGERI TAKUT DI PENJARA,jadi buronan kpk sri mulyani kabur ke luar negeri takut di penjara,jadi buronan kpk sri mulyani kabur ke luar negeri takut di penjara,2,2
H-1116,Surat Tilang APK,surat tilang apk,surat tilang apk,2,2
H-1117,Pertama Kali Indonesia Berikan Status Kewarganegaraan Ganda,pertama kali indonesia berikan status kewarganegaraan ganda,pertama kali indonesia berikan status kewarganegaraan ganda,2,2
H-1118,Banyak Orang Meninggal Akibat Memakan Ikan yang Terkontaminasi HIV,banyak orang meninggal akibat memakan ikan yang terkontaminasi hiv,banyak orang meninggal akibat memakan ikan yang terkontaminasi hiv,2,2
H-1119,Tukul Arwana Meninggal Saat Dilarikan ke Rumah Sakit,tukul arwana meninggal saat dilarikan ke rumah sakit,tukul arwana meninggal saat dilarikan ke rumah sakit,2,2
H-1120,Cerita Reinkarnasi Pelaut Wanita Bernama Renahhta Moe,cerita reinkarnasi pelaut wanita bernama renahhta moe,cerita reinkarnasi pelaut wanita bernama renahhta moe,2,2
H-1121,Kuburan Ferdy Sambo Keluar Api dan Ular,kuburan ferdy sambo keluar api dan ular,kuburan ferdy sambo keluar api dan ular,2,2
H-1122,Ferdy Sambo Teriak Ngamuk Tak Terima Dihukum Mati,ferdy sambo teriak ngamuk tak terima dihukum mati,ferdy sambo teriak marah tak terima dihukum mati,2,2
H-1123,NEGERI JIRAN UNDANG CHINA️ TNI KEPUNG AUSTRALIA DARI SEGALA ARAH,negeri jiran undang china tni kepung australia dari segala arah,negeri jiran undang china tni kepung australia dari segala arah,2,2
H-1124,Presiden Jokowi Pecat Kapolri Listyo Sigit,presiden jokowi pecat kapolri listyo sigit,presiden Jokowi pecat kapolri listyo sigit,2,2
H-1125,PENYANYI JUSTIN BIEBER DIKABARKAN MENINGGAL DUNIA,penyanyi justin bieber dikabarkan meninggal dunia,penyanyi justin bieber dikabarkan meninggal dunia,2,2
H-1126,"RIBUAN MASSA GERUDUK KEMENKEU, TUNTUT SRI MULYANI MUNDUR DARI JABATAN",ribuan massa geruduk kemenkeu tuntut sri mulyani mundur dari jabatan,ribuan massa geruduk kemenkeu tuntut sri mulyani mundur dari jabatan,2,2
H-1127,Aliando Meninggal karena kecelakaan maut,aliando meninggal karena kecelakaan maut,Aliando meninggal karena kecelakaan maut,2,2
H-1128,MOBIL HAKIM DIBAKAR AKIBAT TUNDA PEMILU 2024,mobil hakim dibakar akibat tunda pemilu 2024,mobil hakim dibakar akibat tunda pemilu 2024,2,2
H-1129,DETIK-DETIK KEBAKARAN PERTAMINA PLUMPANG,detikdetik kebakaran pertamina plumpang,detikdetik kebakaran pertamina plumpang,2,2
H-1130,"Harry Tanoesoedibjo Dimiskinkan, Korupsinya Mencapai 72 Triliun Rupiah",harry tanoesoedibjo dimiskinkan korupsinya mencapai 72 triliun rupiah,harry tanoesoedibjo dimiskinkan korupsinya mencapai 72 triliun rupiah,2,2
H-1131,Prabowo Bawa Ribuan Pasukan Tuntut Istana Tolak Penundaan Pemilu,prabowo bawa ribuan pasukan tuntut istana tolak penundaan pemilu,Prabowo bawa ribuan pasukan tuntut istana tolak penundaan pemilu,2,2
H-1132,Bunga Kitolod dapat Mengobati Gangguan Mata Mulai dari Mata Minus hingga Katarak,bunga kitolod dapat mengobati gangguan mata mulai dari mata minus hingga katarak,bunga kitolod dapat mengobati gangguan mata mulai dari mata minus hingga katarak,2,2
H-1133,Video Warga Cina Melarikan Diri ke Vietnam Saat Perbatasan Cina-Vietnam Dibuka,video warga cina melarikan diri ke vietnam saat perbatasan cinavietnam dibuka,video warga cina melarikan diri ke vietnam saat perbatasan cinavietnam dibuka,2,2
H-1134,Air Nanas Panas dapat Membunuh Sel Kanker,air nanas panas dapat membunuh sel kanker,air nanas panas dapat membunuh sel kanker,2,2
H-1135,Putri Candrawati Mengakhiri Hidup di Penjara,putri candrawati mengakhiri hidup di penjara,putri candrawati mengakhiri hidup di penjara,2,2
H-1136,CEO Pfizer Batal ke Luar Negeri Karena Belum Divaksinasi Lengkap,ceo pfizer batal ke luar negeri karena belum divaksinasi lengkap,ceo pfizer batal ke luar negeri karena belum divaksinasi lengkap,2,2
H-1137,Foto Banyak Orang Mengantre Sampai Ada yang Pingsan untuk Beli Jam Jepang di Mall Grand Indonesia,foto banyak orang mengantre sampai ada yang pingsan untuk beli jam jepang di mall grand indonesia,foto banyak orang mengantre sampai ada yang pingsan untuk beli jam jepang di mall grand indonesia,2,2
H-1138,Video Virus Virtex Dikirim Melalui Whatsapp,video virus virtex dikirim melalui whatsapp,video virus virtex dikirim melalui WhatsApp,2,2
H-1139,Ahok Dalang Kebakaran Plumpang,ahok dalang kebakaran plumpang,ahok dalang kebakaran plumpang,2,2
H-1140,"DEMOKRAT TOLAK DEKLARASI ANIES, NASDEM DAN PKS MERADANG",demokrat tolak deklarasi anies nasdem dan pks meradang,demokrat tolak deklarasi anies nasdem dan pks meradang,2,2
H-1141,LAGU MAWAR BODAS DIMAINKAN OLEH ALEXANDRA DOVGAN,lagu mawar bodas dimainkan oleh alexandra dovgan,lagu mawar bodas dimainkan oleh alexandra dovgan,2,2
H-1142,Rusia Serang Brazil Karena Carnival Satanic,rusia serang brazil karena carnival satanic,rusia serang brazil karena carnival satanic,2,2
H-1143,Video Korban Kebakaran Pertamina Penuh Duka Dan Air Mata,video korban kebakaran pertamina penuh duka dan air mata,video korban kebakaran pertamina penuh duka dan air mata,2,2
H-1144,gunung Merapi meletus di pulau Jawa,gunung merapi meletus di pulau jawa,gunung merapi meletus di pulau jawa,2,2
H-1145,Desakan Dunia agar China Menyerah ke Indonesia,desakan dunia agar china menyerah ke indonesia,desakan dunia agar china menyerah ke indonesia,2,2
H-1146,JOKOWI UMUMKAN CALON PENGGANTI KETUA KPK,jokowi umumkan calon pengganti ketua kpk,Jokowi umumkan calon pengganti ketua kpk,2,2
H-1147,HADIAH KAPAL PERANG RUSIA UNTUK FILIPINA,hadiah kapal perang rusia untuk filipina,hadiah kapal perang rusia untuk filipina,2,2
H-1148,Jokowi Berjanji : 1 Periode Lagi Seluruh Hutang Negara Indonesia Akan Lunas,jokowi berjanji 1 periode lagi seluruh hutang negara indonesia akan lunas,Jokowi berjanji 1 periode lagi seluruh hutang negara indonesia akan lunas,2,2
H-1149,Rumah Ahok Jadi Sasaran Pembakaran Warga Plumpang,rumah ahok jadi sasaran pembakaran warga plumpang,rumah ahok jadi sasaran pembakaran warga plumpang,2,2
H-1150,Putin Perintahkan Peluncuran Nuklir ke Amerika,putin perintahkan peluncuran nuklir ke amerika,putin perintahkan peluncuran nuklir ke amerika,2,2
H-1151,Pesan WhatsApp Undangan Rapat Kinerja Tenaga Kesehatan Dinkes Provinsi DKI Jakarta Maret 2023,pesan whatsapp undangan rapat kinerja tenaga kesehatan dinkes provinsi dki jakarta maret 2023,pesan WhatsApp undangan rapat kinerja tenaga kesehatan dinkes provinsi dki jakarta maret 2023,2,2
H-1152,Surat Ketetapan Keberangkatan Haji (SKKH) Tahun 2023,surat ketetapan keberangkatan haji skkh tahun 2023,surat ketetapan keberangkatan haji skkh tahun 2023,2,2
H-1153,Surat Penerima Dana Bantuan Oleh DItjen Bimas Islam Kemenag RI,surat penerima dana bantuan oleh ditjen bimas islam kemenag ri,surat penerima dana bantuan oleh ditjen bimas islam kemenag ri,2,2
H-1154,Gunung Merapi Alami Erupsi 73 Kali Letusan,gunung merapi alami erupsi 73 kali letusan,gunung merapi alami erupsi tujuh puluh tiga kali letusan,2,2
H-1155,Hakim Jaksa Jatuhi Hukuman Mati Pada Putri Candrawati,hakim jaksa jatuhi hukuman mati pada putri candrawati,hakim jaksa jatuhi hukuman mati pada putri candrawati,2,2
H-1156,Putri Candrawati dan Sambo Dibawa ke RS Jiwa karena Mengalami Depresi,putri candrawati dan sambo dibawa ke rs jiwa karena mengalami depresi,putri candrawati dan sambo dibawa ke rs jiwa karena mengalami depresi,2,2
H-1157,AS Ancam Warganya Jika Tolak Ikut Perang Melawan Rusia,as ancam warganya jika tolak ikut perang melawan rusia,as ancam warganya jika tolak ikut perang melawan rusia,2,2
H-1158,Warga AS Salahkan Pemerintahan Biden atas Konflik dengan Rusia,warga as salahkan pemerintahan biden atas konflik dengan rusia,warga as salahkan pemerintahan biden atas konflik dengan rusia,2,2
H-1159,PJ Heru Hampir Tak Tertolong Karena Dikeroyok Massa di Depan Balaikota,pj heru hampir tak tertolong karena dikeroyok massa di depan balaikota,pj heru hampir tak tertolong karena dikeroyok massa di depan balaikota,2,2
H-1160,Megawati saya sudah Jelas masuk surga malaikat kenal sama bapak saya Soekarno,megawati saya sudah jelas masuk surga malaikat kenal sama bapak saya soekarno,megawati saya sudah jelas masuk surga malaikat kenal sama bapak saya soekarno,2,2
H-1161,AHOK resmi jadi ketua KPK menggantikan Firly,ahok resmi jadi ketua kpk menggantikan firly,ahok resmi jadi ketua kpk menggantikan firly,2,2
H-1162,Ganjar saya dari kecil hobi nonton film porno sampai lupa makan,ganjar saya dari kecil hobi nonton film porno sampai lupa makan,ganjar saya dari kecil hobi nonton film porno sampai lupa makan,2,2
H-1163,Ziarah di Makkah dan Madinah dihentikan mulai 7 Maret sampai Hari Raya Idul Fitri,ziarah di makkah dan madinah dihentikan mulai 7 maret sampai hari raya idul fitri,ziarah di makkah dan madinah dihentikan mulai tujuh maret sampai hari raya Idul fitri,2,2
H-1164,Lowongan Kerja Petugas Haji Tahun 2023,lowongan kerja petugas haji tahun 2023,lowongan kerja petugas haji tahun 2023,2,2
H-1165,Video Ferdy Sambo Dipindahkan Ke Nusakambangan,video ferdy sambo dipindahkan ke nusakambangan,video ferdy sambo dipindahkan ke nusakambangan,2,2
H-1166,PEMAKAMAN FERDY SAMBO DISAKSIKAN JUTAAN ORANG,pemakaman ferdy sambo disaksikan jutaan orang,pemakaman ferdy sambo disaksikan jutaan orang,2,2
H-1167,"Pura Saraswati, Bali, Indonesia di pusat Ubud",pura saraswati bali indonesia di pusat ubud,pura saraswati bali indonesia di pusat ubud,2,2
H-1168,AKIBAT ULAH SENDIRI !! SUGIK NUR DIHAJAR TEMAN SATU SEL HINGGA BABAK BELUR BEGINI,akibat ulah sendiri sugik nur dihajar teman satu sel hingga babak belur begini,akibat ulah sendiri sugik nur dipukul teman satu sel hingga babak belur begini,2,2
H-1169,"JUTAAN SANTRI TURUN GUNUNG, DESSAK CAK NUN SEGERA DI TANGKAP",jutaan santri turun gunung dessak cak nun segera di tangkap,jutaan santri turun gunung dessak cak nun segera di tangkap,2,2
H-1170,Indra Bekti Ungkap Alasan Cerai Dengan Aldilla Jelita,indra bekti ungkap alasan cerai dengan aldilla jelita,indra bekti ungkap alasan cerai dengan aldilla jelita,2,2
H-1171,Pidato Hillary Clinton di India: ‘Saatnya Melarang Penggunaan Uang Tunai untuk Melawan Perubahan Iklim,pidato hillary clinton di india saatnya melarang penggunaan uang tunai untuk melawan perubahan iklim,pidato hillary clinton di india saatnya melarang penggunaan uang tunai untuk melawan perubahan iklim,2,2
H-1172,"MAHFUD MD ENDUS KONGKALIKONG FIRLI & ANIS, PANTAS FORMULA E TIDAK DIUSUT",mahfud md endus kongkalikong firli anis pantas formula e tidak diusut,mahfud md endus kongkalikong firli anis pantas formula e tidak diusut,2,2
H-1173,TANGIS SBY PECAH SEKETIKA !! MENDENGAR HARRY T UNGKAP PERAN YANG SEBENARNYA !!,tangis sby pecah seketika mendengar harry t ungkap peran yang sebenarnya,tangis Surabaya pecah seketika mendengar harry t ungkap peran yang sebenarnya,2,2
H-1174,Anies Baswedan Dekat Dengan Aliran Krsiten Sesat Alpha Omega di Papua,anies baswedan dekat dengan aliran krsiten sesat alpha omega di papua,anies Baswedan dekat dengan aliran krsiten sesat alpha omega di papua,2,2
H-1175,Hakim Wahyu Iman Santoso Alami Kecelakaan Tunggal Usai Vonis Mati Ferdy Sambo,hakim wahyu iman santoso alami kecelakaan tunggal usai vonis mati ferdy sambo,hakim wahyu iman santoso alami kecelakaan tunggal usai vonis mati ferdy sambo,2,2
H-1176,GAMBAR MEGAWATI DAN PUAN BERMAIN SLOT,gambar megawati dan puan bermain slot,gambar megawati dan puan bermain slot,2,2
H-1177,JONATHAN LATUMAHINA SEORANG NASRANI DAN PENYUSUP DI ORMAS ISLAM,jonathan latumahina seorang nasrani dan penyusup di ormas islam,jonathan latumahina seorang nasrani dan penyusup di ormas islam,2,2
